product_id,title,description,brand,category
356,CamelBak Reservoir & Water Bottle Cleaning Tablets (8 Pack),"SKU CamelBak Reservoir & Water Bottle Cleaning Tablets (8 Pack) Highlights Keep your reservoir and water bottles free from taste and odor and ready for your next adventure with our CamelBak cleaning tablets Each pack contains 8 cleaning tablets, which are notched to easily break in half for cleaning smaller vessels Self-dissolving tablets help reduce residual taste and odor Tabs are notched to break in half for cleaning smaller vessels Free from chlorine, phosphate, preservatives, and fragrances Not harmful to aquatic environments Formulated with Claro, a leader in eco-friendly cleaning solutions Specifically designed for CamelBak reservoirs and water bottles Tablets leave no odor, film, or residue Environmentally safe and biodegradable No irritating fumes",,
357,Schacht Collapsible Lazy Kate,"From Schacht Spindle Co.: We took physics to heart when we designed this lazy kate. It is built low to the ground (no tipping over during plying), has a unique tensioning feature (no more bobbin back-spinning during plying), and accommodates up to three bobbins. It can be easily disassembled, making it easy to transport or pack — no tools required! Our kate can be used with other spinning wheel bobbins up to 7"" in length. Note: A Schacht Collapsible Lazy Kate comes with Schacht Matchless wheels but may also be purchased separately.",,
358,Shark Splash Dizzy Danglers - 3 pack,"3 in a pack 36"" * DC",,
359,木製カトラリー 黒 フォーク M (本商品の販売を終了致しました),商品名 木製カトラリー 黒 フォーク M (本商品の販売を終了致しました) カタログ品番 c7013002 お届けの目安 3～5日以内に発送予定（土日祝除く） 色 ー サイズ 長径13×短径1 (cm) 重量 - シリーズ 木製カトラリー メーカー ブランド 素材 天然木/ウレタン塗装 生産国 中国 用途 【業務用】【家庭用】 木、フォーク 備考 ※食器洗浄機、乾燥機使用不可 ※天然素材のため、木目や色合い、サイズが異なる場合がございます。 ・当店では、お客様からのご注文後に、提携先メーカーに在庫確認と発注手配を行います。その為、「在庫有」の商品であってもご注文時に欠品や再入荷待ちとなる可能性がございます。予めご了承ください。 ・商品の発送にはご注文後3日～1週間程度を頂戴しております。 ・破損、不良品を除き、お客様都合による商品の返品・交換は一切お受けできません。サイズ、ご注文数等を良くご確認の上、ご注文をお願い致します。 カタログ番号:ky21-379-c7013002 JANコード カタログ koyo23-381,,
360,Transport-Recovery Stretcher Trolley light grey | turquoise,"Product overview With rotatable side rails Central adjustable double castors Push handles on both ends With all-round protective bumper Optionally available laundry basket Transport/Recovery Stretcher Trolley This transport trolley stretcher is equally suited for moving patients, as well as for use in PACU following operations. The bed combines modern design with one of a kind functionality. This fully-equipped transport stretcher with central, adjustable double castors not only has a push handle at the head, but also at the foot and is even equipped with a laundry basket. Please note that the laundry basket is not included in the scope of delivery, but can be ordered on request. Quality Transport Stretchers Made in Germany Made of select, high-quality materials Precise workmanship 36 months warranty Product Details Transport/Recovery Stretcher Trolley from AGA Equipped with rotatable side rails, which can be secured by displaceable studs (if both side rails are rotated upside down, th",,
361,"Gardner Spring - 1/4"" Bolt, 0.265"" ID, Grade 301 Stainless Steel, Curved Disc Spring - 0.49"" OD, 0.091"" High, 0.008"" Thick",Item #: 03714805 Brand: Gardner Spring Model #: MU250-0075-S Exact Tooling IR#: 04 Features and Benefits Curved disc springs create a spring-like action and can support heavy loads. They are slightly bent along the outside diameter. Product Specifications Type Curved Disc Spring Bolt Size (Inch) 1/4 System of Measurement Inch Inside Diameter (Decimal Inch) 0.2650 Material Stainless Steel Material Grade 301 Outside Diameter (Decimal Inch) 0.4900 Thickness (Decimal Inch) 0.0080 Overall Height (Decimal Inch) 0.0910 Deflection (Decimal Inch) 0.0334 Deflection to Flat (Decimal Inch) 0.0460 Load at Deflection (Lb.) 3.50,,
362,100% Accuri/Strata/Racecraft Lens - Green Mirror 51002-005-02,"Pre-curved, injected polycarbonate shield lens Tear-off compatible",,
363,"RAM Game Room 48"" Folding Game Table-Antique White FLDGTBL AW","The folding game table is the perfect option for the occasional player. Finished in classic black, this table offers all of the beauty and functionality of our regular tables but has the unique ability to fold up for storage when it's not game night. A great value choice. Specifications Solid Wood with Padded Vinyl Playing Surface Assembled Length (IN): 48 Assembled Width (IN): 48 Assembled Height (IN): 30 Assembled Weight (LBS): 110",,
364,Air Pump Brake Bleeder Tank,"Brake Bleeder Tank, Application Bleeding Brakes, Number of Pieces 1, Material Steel, Includes 12 ft Long Hose, 4 Gallon Capacity Tank, Automatic Fluid Shut-off, Casters graingerSKU: 11U417, mscSKU: , zoro_no: G3717287, mongo_id: 65bbe97a22d7a989a995a141",,
365,Spectra Narrow/skinny Neck Adapter,Spectra narrow/skinny neck adapter.,,
366,"Kèn Trumpet Yamaha YTR-8330EM Bb Custom, Gold","Yamaha YTR-8330EM là mẫu trumpet Bb chuyên nghiệp được phát triển bởi nghệ sĩ nổi tiếng quốc tế Eric Miyashiro, nâng cấp toàn diện từ phiên bản đầu tiên ra mắt cách đây 17 năm. Với thiết kế mới được tối ưu về hiệu suất và cảm giác chơi, cây trumpet này không chỉ giữ được sức mạnh và độ phản hồi ấn tượng của phiên bản trước mà còn cải thiện đáng kể khả năng kiểm soát ở quãng cao. Yamaha YTR-8330EM là lựa chọn lý tưởng cho các nghệ sĩ biểu diễn chuyên nghiệp đang tìm kiếm một nhạc cụ đỉnh cao về âm thanh lẫn thiết kế. Kèn Trumpet Yamaha YTR-8330EM Bb Custom Yamaha YTR-8330EM – Trumpet Bb Signature Của Eric Miyashiro Phiên Bản Mới Thiết Kế Ống Dẫn Và Khớp Nối Miệng Kèn Mới YTR-8330EM sở hữu ống dẫn (leadpipe) và khớp nối miệng kèn được thiết kế lại hoàn toàn, giúp cải thiện độ phản hồi và tăng khả năng kiểm soát âm thanh. Độ kháng hơi vừa phải hỗ trợ người chơi lên nốt cao dễ dàng hơn, đồng thời giúp biểu cảm âm nhạc chính xác và ổn định hơn trong mọi hoàn cảnh trình diễn. Cấu Trúc Step B",,
367,BRUSH POLY FILL CLEANING,Poly fill parts cleaning brush. 10-1/2” overall length.,,
368,Energizer Lithium Battery L91,"High power-efficient high-tech digital equipment lithium batteries! lithium battery specifications: aa voltage: 1.5 V features: 2900mah up to seven times longer than energizer max use until the end of its life, maintain a constant output, digital high-tech devices that require high power efficiency, shoot digital cameras: up to 600 sheets, 33% lighter weight than ordinary alkaline batteries, operating temperature 0 ~ 60 shelf life: 15 years",,
369,Kit de nettoyage de pinceaux de maquillage,"Découvrez notre Kit de Nettoyage de Pinceaux de Maquillage, l'outil indispensable pour maintenir vos pinceaux impeccables et votre peau en bonne santé ! Conçu pour offrir une solution de nettoyage efficace et pratique, ce kit vous permettra de préserver la qualité de vos pinceaux tout en éliminant les impuretés et les bactéries. Notre kit comprend une variété d'accessoires spécialement conçus pour répondre à tous vos besoins de nettoyage de pinceaux. Le nettoyant doux et efficace élimine en profondeur les résidus de maquillage, l'huile et les impuretés, laissant vos pinceaux propres et prêts à être utilisés. En utilisant notre kit de nettoyage de pinceaux de maquillage régulièrement, vous prolongerez la durée de vie de vos pinceaux tout en préservant la santé de votre peau. De plus, son format compact et son design élégant le rendent idéal pour une utilisation à domicile ou en déplacement. Offrez à vos pinceaux le soin qu'ils méritent avec notre Kit de Nettoyage de Pinceaux de Maquilla",,
370,DR BRUX BITE NOTTE SUP TRASPARENTE,,,
371,IPU Shower Chair ipu® Mesh Back - M-1027542-2617 - Each,"Delivery - 1-2 Weeks, Directly Ships from the Manufacturer New comfortable open front soft seat 5 Inch Heavy duty casters - 2 locking and 2 non-locking Removable pail Easy to clean Designed for the larger patients Holds up to rigorous use Specification: 27 X 31 X 40 Inch, 27 Inch Between the Arms Item Id 1027542 MF ID VL OF20 P 500 G Brand IPU® Manufacturer IPU Application Shower Chair Backrest Type Mesh Back Color Gray Seat Height 22 Inch Height UNSPSC Code 42211610 Weight Capacity 500 lbs. Weight Capacity Wheel Type 5 Inch Casters",,
372,Cable Driven Electronic Speedo for 1947 to Present Dash,"GZP Electronic Speedo for 47up FatBob MP Cable driven electronic controlled black faced speedo with digital odometer and 2 trip meters. Comes pre-wired with a push button switch to select trip 1, trip 2 or odometer and is programmable for use with any ratio speedo drive. Installation instructions and an adapter nut for use with either 5/8"" or 16mm speedo cable nut. Meter is 41/4"" (108mm) in diameter and a 43/4"" (120mm) top ring. Fits most Fat Bob style dashes 1957 thru 1995. Available with 120 MPH or 220 KM/H scales. HS Number: 8714109090",,
373,HOUSING END 8M - (10 PKG) 01-0006,MFG Part Number: 01-0006 (Fittings sold only in package of 10-priced per package) Cable housing end 8mm for 7mm housing.,,
374,Alchemy Dart Flights - No2 - Std - Copper - Samain Skull,Designa Alchemy Dart Flight Collection - Extra Strong 100 Micron Dart Flights. Each pack contains 3 flights. Alchemy Dart Flights - No2 - Std - Copper - Samain Skull,,
375,Easter Printed Paper Plates in 3 Assorted Designs - (10 Pack),"Delight all of the family over Easter with our Easter printed paper plates. Great for parties, celebrations and more. These paper plates will also save on the washing. Available in three assorted designs, Easter eggs, Easter bunnies and Easter chicks.Each pack contains x10 printed paper plates with a 23cm dia with ridged edges to help prevent spills. Each plate is constructed from Food Grade Card.",,
376,"Zac ZL-3116NX New Gold Metal Ligature X-Grip - For Alto Sax Ebonite Mouthpiece, Medium Size","MODEL ZL-3116NX INSTRUMENT ALTO SAX MOUTHPIECE MATERIAL MEDIUMSIZE EBONITE ALTO SAX COMPATIBLE MOUTPIECE BRAND - MODEL BARI / HR BERG LARSEN / HR CLAUDE LAKEY / HR DRAKE / PHIL WOODS-JAZZ-NY JAZZ(CERAMIC RESONANCE) JODY JAZZ / HR* JAMES BUNTE / HR MEYER / HR-NY OTTO LINK / TONE EDGE PHIL-TONE / INTREPID RASCHER / HR ROUSSEAU / ER50 CLASSIC-NC-NC 3.0"" SELMER / S90-S80-CONCEPT TED KLUM / YARD BIRD VANDOREN / V5(A27/A28)-OPTIMUM(AL3/AL4)-PROFILE-V16 JAZZ YAMAHA / 4C-5C-6C MOTHER ELEMENT Z-MOTHER21 new model, polished brass plated 24k gold MODEL MOTHER ELEMENT ZM21-30N CORDS X-grip w/brass clamps MODEL CORDS ZC16-OTX RESONATOR Satin Brass MODEL RESONATOR ZR2-OT SIZE 16 Mother : ZM-30N (New model, mother element polished brass plated with 24 carat gold 3 micron guaranteed) Cords : ZC-OTX (Extra grip cords, brass clamps) Resonator : ZR-OT (Satin brass resonators, very good sound projection) Sound : Warm and centered sound Harmonics : Very good highs and mid frequencies, good bass frequencies",,
377,"popotop Photo Album 4x6-420 Photos Photo Books with 420 Horizontall Pockets,Linen Cover Albums for Family Wedding Anniversary Baby Vacation Pictures","Overview Brand : popotop Color : Grass Green Material : Linen Specific Uses For Product : Photo Album Recommended Uses For Product : Photo Album, Scrapbook About this item 📐Perfect Size & Capacity: The size of photo albums is 13 x 7.5 x 2.7 inches. It can hold 420 4x6 inch photos horizontally, each pages holds 3 photos(Note: This album can hold standard 4""x6"" photos. If the inner pages do not fit properly or are damaged, please contact us and we will offer you a refund or replacement.) 📔Exquisite Linen Cover: The album is exquisite and generous in appearance. High-quality linen cloth is tightly wrapped around the cover. The cover has a picture display window, you can insert photos according to your idea and customize your unique personal album. ✅Acid Free & PVC Free: The inner pages are made of acid-free, lignin-free and PVC-free materials that won't damage or oxidize your photos.Popotop's albums help you preserve your photos for a long time so that your precious memories can be stay i",,
378,"Baby Feeding Bottle with Handles & Straw (Mix Design, Size & Color / 1 Pc)","Glass / plastic Baby Feeding Bottle with Plastic Handles & Silicone Straw Leakproof, BPA Free & Non-Toxic for Baby | Toddlers, Water Bottle, Milk Bottle for New Born / Infants (Mix Design, Size & Color / 1 Pc) Description :- 1. SAFE MATERIAL：It is a glass, which is a perfect material for baby bottles. It is incredibly durable, temperature and fall resistant. 2. BREAST LIKE - The nipple is made of super soft and flexible silicone, and the same shape as mom's nursing nipple for a familiar fit. Matte surface enables the baby to get a secure and continuous latch. 3. UNIQUE DESIGN - The ergonomic design makes this bottle comfortable for both parents and babies to hold, which brings a good mood to mothers and babies. And handle is perfect to protect the child's wrist and can help baby control drinking. 4. DRINK IN EVERY ANGLE - 360 Degree Drinkable Straw Group-Weighted straw moving with liquid allows your baby drink from any angle, drink milk more casual and relax. 5. EASY TO CLEAN - wide ne",,
379,Cutting guide BOSCH 2609255732,"If you like to take care of every detail in your home and own the latest products that will make your life easier, purchase Cutting guide BOSCH 2609255732 at the best price. General Product Safety Regulations information: BSH Hausgeräte GmbH Carl-Wery-Straße 34 81739 München, Germany 81739 - Munchen +34683468881 alexander.eisenberg@bshg.com https://www.bshg.com",,
380,Shimano BL-M7100 RH BL Member Unit,.top{margin-bottom:30px;}.top li{margin-left:5%;margin-right:5%;margin-top:10px;line-height:120%;list-style-position:outside;} Shimano BL-M7100 RH BL Member Unit. Shimano hydraulic brake lever small parts for replacement and repairs.,,
381,Ashaway SuperNick XL - 9m Squash String - White/Red,"The Ashaway Super Nick XL squash string is composed with the Zyex multifilament technology which will allow you to increase your power and resilience. It's also prevent form tension loss. Ashaway SuperNick XL 9m Squash String You will have a squash string that will reliable, you don't have to worry to break it during a match ! With his braided surface, you also go to maximes control and increases spin. Professional or beginner, this squash string will adapt himself perfectly to your level. This squash string is also available in reel of 110 meters. Looking for more? Explore our full collection of Squash Strings for even more styles, colors, and options to fit your needs.",,
382,Adaptor Dji,"If you're passionate about IT and electronics , like being up to date on technology and don't miss even the slightest details, buy Adaptor Dji at an unbeatable price. Type: Adaptor Colour: Black Characteristics: Water resistant Touchscreen Built-in microphone Built-in display Guarantee Installation guide included Night mode Connectivity: Bluetooth Wi-Fi Image format: JPEG Power supply: Battery IP rating: IP68 Approx. autonomy: 3 hours Sensor: CMOS Maximum memory card size: 1 TB Includes: Rechargeable lithium battery USB Type-C - USB Type-C Not included: Adapter AC Compatible memory cards: MicroSD (TransFlash) Internal Memory: 128 GB Battery type: Litio Ion Diagonal of the screen (cm): 5,1 cm General Product Safety Regulations information: DJI Europe B.V. WTC Schiphol, Tower A, Schiphol Boulevard 231, Schiphol, Netherlands, 1118BH 1118BH - Schiphol +31854010338 support.eu@dji.com https://www.dji.com",,
383,Detergent 1 gal 12.4 pH Max,Detergent Container Size 1 gal Product Form Liquid Maximum pH Level 12.4 pH Fragrance Unscented Container Type Bottle Product Type Detergent Active Ingredients Potassium Hydroxide Silicic Acid Sodium Hypochlorite Sodium Salt Solution Recommended Dilution 1 200,,
384,Elegant Organza Ladies Day Horse Race Pure colour Fedora Hat/Fascinator,"Material: Organza Occasion: Cocktail , Horse Race , Wedding Embellishment: Feather , Tulle,Pure colour",,
385,Wooden Fountain Planter with Hanging Buckets Brown Wood,Item Name: Wooden Fountain Planter with Hanging Buckets Brown Wood Description: Color : Brown Material : Wood Product Size : 22.0 In. W X 46.3 In. H X 22.0 In. D Assembly : Assembly Required Wooden Fountain Planter With Hanging Buckets Brown Wood | Material : Wood. Assembly : Assembly Required | Product Size: 22.0 In. W X 46.3 In. H X 22.0 In. D.,,
386,4.00-19 SL 4PR B STA American Farmer Farm Front F-2 TT,American FarmerÂ® Farm Front F-2 3 Rib Features and Benefits: Firm traction for steering front on two-wheel drive tractors. Better hillside control than a four-rib tire Rib tire design cleans soil and mud quickly.,,
387,"250% Density Chocolate Brown Lace Front Wig Human Hair 13x4 Body Wave Lace Front Wigs with Baby Hair Colored Human Hair Wigs For Women HD Transparent Lace Front Wig(18 Inch,Chocolate Brown Wig)",Brand: FKFO Details: chocolate brown lace front wig light brown wig chocolate brown wig brunette wig long brown wig light brown human hair wig chocolate brown human hair wig brown lace front wig light brown wig human hair brown glueless wig brown 13x6 hd lace front wigs human hair chocolate wig brown wigs human hair chocolate brown wig human hair chestnut brown human hair wig light brown lace front wigs human hair long dark brown wig chocolate brown glueless wig human hair chocolate brown lace front wig human hair 13x6 chocolate brown hd lace frontal wig,,
388,Play Kevlar Wick- 50mm - (1) 3 foot length,Our wicks are extremely compact and made of 100% KEVLAR. We dedicated a lot of attention to the way the thread is weaved in order to have the maximum absorption. Some of the most inportant fire props manufacturers in Europe already tested and adopted our wicks for their products and this allow us to produce big quantities. Enjoy!,,
389,Plug Schrader Standard Steel HD 1/4,Plug Schrader Standard Steel Heavy Duty 1/4 In.,,
390,RDS Firestar Skate Girls Pink Camo Roller Skates,"Watch her roll out on the Roller Derby® Girls' Firestar Quad Roller Skates. This stylish skate delivers lasting comfort for your little one with a padded collar and comfort sport design. The power strap holds her foot securely so she feels confident to skate without holding onto you. Once she gets moving, the 54mm wheels and Excellerator 608ZB bearings will keep things smooth. Fits true to U.S. children's shoe size. ROLLER DERBY FireStar Youth Girl's Roller Skates Feature: SIZING Regular U.S. children's shoe size CLOSURE Sport shoe design with power strap & lace closure boot CHASSIS Lightweight torsion beam frame WHEELS 54mm Urethane wheels BEARINGS 608Z Excellerator bearings",,
391,Power Tower – Pull Up Bar with Adjustable Bench & Dip Station,,,
392,Large Rolling Pin Guide Rings [<>],"Includes a set of four (4) PME Large Rolling Pin Guide Rings. Ring depths measure 1.55mm, 3.35mm, 6.25mm and 12.6mm. ?? Works great for rolling out sugarpaste, marzipan or petal paste. Simply slip the rings on your rolling pin and start rolling over your",,
393,Free Top View Of Desk With Frame And Pencils Psd,Visit Download Page Free Top View Of Desk With Frame And Pencils Psd for any designer that is looking to display their design professionally. Freepik has created this amazing high-resolution photoshop mockup. You can add your own creative in to this clean mockup.,,
394,Nintendo Switch Power Cable,"Brand new third party Nintendo Switch Power cable. Use it alone on the console, or use it on the tv dock. Compatible with: Nintendo Switch, Switch OLED, Switch Lite",,
395,Wiseman Single Oboe Case,"THE WISEMAN SINGLE OBOE CASE As used by players in many of the World s Leading Orchestras. FEATURING : Black Leatherette - covered lightweight hard tubular case constructed from molded plastic and aluminum. The case is hinged along its length, folding open into two equal halves. Heavy duty metal clasp locks on both ends. Thick leather Handle and ends for durability. 4 inch diameter tubular construction for maximum strength and space efficiency. Inserts cut from highest quality shock absorbing rubber blocks, as used for packaging scientific equipment. All inserts lined with top quality Supa-Crushed Velvet. Wide range of colours available. No pressure on any Oboe keywork. Superb insulation provided around instrument joints by foam, from foam/velvet cushions between the two halves of the case, and from the rubber inserts themselves. Superb protection from heavy rain. Detachable external tool/accessory bag supplied (apprx: 5 x 8 x 1.5 ). Will fit all makes of Oboe. Any unusual keywork etc.",,
396,Vinstativ for 73 flasker svart 45x36x200 cm smijern,"Oppbevar, elde og vis vinen din i stil med dette vinstativet! Stor kapasitet: Denne vinholderen kan holde opptil 73 flasker, og maksimerer effektivt lagringsplassen og holder området ryddig. Stabil konstruksjon: Denne vinflaskeholderen er laget av solid smijern med en svart pulverlakkert finish for å motstå oksidasjon og rust. De medfølgende veggfestene forhindrer vinstativet i å vippe, noe som gjør det egnet for mange års bruk. Passer mange steder: Med et enkelt og elegant design er dette vinoppbevaringsstativet perfekt for bruk i barer, vinkjellere, kjøkken, restauranter og mer. Låsbar: Dette vinstativet i metall kan låses for å forhindre at vinflaskene dine faller, noe som gir mer sikkerhet. Advarsel: For å forhindre at det velter må dette produktet brukes med den medfølgende festeanordningen. Farge: svart Materiale: smijern med pulverlakkert overflate Samlet mål: 45 x 36 x 200 cm (L x B x H) Lengde lås: 16 cm Kan holde opptil 73 flasker vin Montering kreves: ja Legal Documents: Fle",,
397,Verkada 1-Year Cellular Backup License,Verkada 1-Year Cellular Backup License,,
398,Dura-Tech Winners Choice Quilted Equestrian Bags Collection | Ultimate Horse Show Companion | Perfect for Every Equestrian,"About This Color Navy - Superior insulation and double diamond quilting safeguard your horse show essentials, maintaining them in pristine condition. SPACIOUS & ORGANIZED - Comprehensive set includes garments, saddles, bridles, and more, each perfectly fitted in its specialized compartment. ROBUST MATERIALS - Constructed from durable 600D poly fabric, our bags resist dirt and wear, ideal for the rigorous farm and barn life. DESIGNED FOR EQUESTRIANS - Each bag is tailored to meet the needs of horse enthusiasts, ensuring functionality at shows or in the stable. COLOR VARIETY - Choose from black, grey, navy, or burgundy to match your personal style or stable colors.",,
399,Marina,"This couture ensemble draws on the lyrical elegance of chinoiserie. The pale terracotta raw silk jacket, A-line in form, is richly hand-embroidered with resham florals and motifs in soft blues, greens, and beige, brought to life with delicate embellishments. Crystal fringe edges its hems and sleeves, catching light with every movement. Worn over an asymmetrical one-shoulder blouse in pleated net, encrusted with crystals, beads, sequins, and finished with pearl drops, the look finds its anchor in a two-tone peach knotted skirt in sheer soft net. Together, the palette of terracotta, blush, and blue creates a vision that is both painterly and ethereal.",,
400,Purple Color Cooling Pillow Case,"Elevate your home decor with our luxurious silk and velvet pillow covers . Our covers are expertly crafted with exquisite attention to detail, seamlessly blending opulence with comfort to offer a touch of elegance to any space. The smooth silk texture and plush velvet accents create a visually stunning and inviting atmosphere that is sure to impress. With a wide range of colors and patterns available, you can easily find the perfect match for your decor. Trust in the durability of our silk and velvet pillow covers to keep your home looking stylish and comfortable for years to come. Insert is not included.",,
401,Train Whistle,"Every kid loves making noise, it's part of growing up! Give them a gift that will become an instant keepsake by personalizing a train whistle with their name and a fun, playful icon. Depth: 1.375"" Width: 1.375"" Height: 7.5""",,
