product_id,title,description,brand,category
268,"[ 2 Packs ] Pet Hair Removal Comb Flea Comb, New Cat Brush with Release Button Pet Hair Grooming Brush Supplies (Yellow+Green)","About This One - Button Self - Cleaning, A Hassle - Free Solution: Bid farewell to the arduous task of cleaning pet hair from brushes. Our Pet Hair Removal Comb comes equipped with a revolutionary self - cleaning mechanism. With just a simple push of a button, the accumulated pet hair is effortlessly released. This innovative design not only saves you time but also significantly enhances the efficiency of hair removal, eliminating the need for time - consuming and troublesome cleaning procedures. Promote a Lustrous and Healthy Coat: Regular grooming with our pet hair removal brush serves a dual purpose. It effectively tackles the issue of excessive shedding while simultaneously promoting a healthier and more radiant coat for your furry companion. The gentle massage action during grooming stimulates blood circulation in the skin, which in turn encourages the natural production of oils. This results in a shinier, silkier, and overall better - conditioned pet fur. Ergonomic Non - Slip Han",,
269,Tobin Sports Canyon Pro 3 Person Inflatable Raft Set Inflatable Boat Rib Boat,"The Tobin Sports Canyon Pro is a 3-person inflatable raft perfect for fishing or cruising on the lake. This boat is inflatable and convenient, yet sturdy and long-lasting. The Canyon Pro is constructed with Tritech™ material, which can withstand weight, strain and movement, along with UV rays. This material offers superior strength and durability without adding bulk or weight. The boat floor is made with drop stitch material, which inflates to a high level of firmness and rigidity so you can move around comfortably and smoothly, along with inflated cushions to keep riders secure and comfy. Control the Canyon Pro with the included pair of oars that can placed in the omni-directional oarlocks for multi-direction navigation. This boat also features built-in fishing rod holders to keep your line in the water as you grab a drink or just relax and enjoy the day. The boat includes grommets that can attach to a 1.4 hp (1.0 kw) motor mount if you want some extra power for your day on the water ",,
270,Pearl Milling Company Sciroppo per Pancake,"Lo sciroppo per pancakes di Pearl Milling Company, marchio precedentemente conosciuto come Aunt Jemima, è l'ideale per guarnire i tuoi pancake fatti in casa! Famoso per la sua consistenza densa e ricca e per il suo sapore dolce e invitante, lo sciroppo Pearl Milling è realizzato con ingredienti di alta qualità e offre un equilibrio perfetto tra dolcezza e consistenza, per una colazione indimenticabile ogni volta che lo usi. Puoi versarlo generosamente sopra i tuoi pancake caldi appena fatti o usarlo per dare un tocco dolce ai tuoi dessert preferiti! Quantità: 710ml Paese d'origine: STATI UNITI INGREDIENTI Sciroppo di mais, sciroppo di glucosio-fruttosio, acqua, addensante (E466), colorante (E150a), sale, aroma naturale e artificiale, conservanti (E211, E200), emulsionante (E452i).",,
271,Polare Luxury RFID Blocking Leather Passport Holder Travel Wallet For Men and Women (Black with AirTag Slot),"About This Real Leather Craftsmanship – Each wallet is made from luxury Napa leather. Around with reinforced stitching, it will not tear or become loose, making it both handsome and reliable for long-term use. Dimensions: 4.5(L)*6(H) inches /11.5(L)*15.4(H) cm. Item weight: 0.26lb/0.12kg. Designed with a built-in AirTag holder to keeps your AirTag securely in place. Put your AirTag into the snap AirTag slot and never lose your passport wallet again, providing added security and convenience during your travels. (AirTag Not Included) RFID Travel Protection: Along with a premium texture, these RFID blocking wallets keep “chip” cards, personal and financial information safe from digital scans. Perfect Holiday Gift for Travellers: The perfect present for Mother's Day, Father's Day, anniversaries and birthdays. Delight that special person in your life and buy now! Warranty and Support: Premium 2-Years Warranty and lifetime customer service. Every slim wallet we create is backed by unbeatable",,
272,5Core Megaphone Bullhorn Speaker 30W Mini Bull Horn Battery Power Megafono 800 Feet USB,"About Item: 【Powerful Sound Projection 】– With 30W power, this megaphone speaker projects your voice up to 800 yards, making it ideal for large crowds, sporting events, and outdoor activities. The loudspeaker ensures your message is heard without straining your voice. 【Alert with Siren Mode 】– Easily grab attention with the built-in siren feature. Activate the alarm mode at the push of a button for instant, loud emergency or alert notifications, perfect for events and crowd control. 【Volume Adjustable for Control 】– Adjust the audio output to your needs with the convenient volume control slider located at the back of the bullhorn megaphone, ensuring the perfect sound level for any situation. 【Multiple Input Options 】– Expand your communication reach with the multi-input feature. Connect an external audio source via USB or SD card, making this portable voice amplifier a perfect companion for public announcements and events. 【Works in All Weather Conditions 】– Constructed from durable AB",,
273,"Sioux Tools - 1/4"" Bit Holder, 700 RPM, Pistol Grip Handle Air Screwdriver - 220 In/Lb Torque, 30 CFM",Item #: 73958779 Brand: Sioux Tools Model #: SSD10P7S Exact Tooling IR#: 04 Features and Benefits Pistol grip handles are positioned on the rear end of the tool. It is commonly used for vertical operations. Product Specifications Handle Type Pistol Grip Torque (In/Lb) 220.00 Bit Holder Size (Inch) 1/4 Speed (RPM) 700 Air Consumption (CFM) 30.00 Inlet Size (NPT) 1/4 Torque (N/m) 24.86 Air Consumption (LPS) 14.16,,
274,Topoisomerase II alpha Antibody / TOP2A,"TOP2A encodes a DNA topoisomerase, an enzyme that controls and alters the topologic states of DNA during transcription. This nuclear enzyme is involved in processes such as chromosome condensation, chromatid separation, and the relief of torsional stress that occurs during DNA transcription and replication. It catalyzes the transient breaking and rejoining of two strands of duplex DNA which allows the strands to pass through one another, thus altering the topology of DNA.",,
275,【日本銘石】ルース 北海道産蛍光オレンジオパール ＜北海道登別産＞ カボション [ac-g8057],,,
276,Conjunto de Treino Benfica 2025-26 - Casaco sem Capuz,"Conjunto Esportivo Perfeito: Blusa e Calça para o seu Dia a Dia e Treinos! Chegou o conjunto que une conforto, estilo e desempenho , perfeito para acompanhar você em todos os momentos, seja nos treinos, nos momentos de lazer ou no dia a dia. Com um design moderno e pensando na sua liberdade de movimento, nossos conjuntos de blusa e calça são a escolha ideal para quem não abre mão de qualidade e versatilidade. Principais Características: Material Premium: Confeccionados com uma combinação inteligente de poliéster e elastano de alta qualidade , nossos conjuntos oferecem a flexibilidade e o conforto que você precisa, com toque macio e durabilidade excepcional. Design Versátil: Com um design elegante e contemporâneo , nossos conjuntos são perfeitos para diferentes ocasiões. A blusa possui um corte que se adapta bem ao corpo, e a calça um caimento que proporciona liberdade de movimento. Conforto Respirável: O tecido com tecnologia respirável ajuda a manter você fresco e seco, controlando a ",,
277,رغوة تبييض الاسنان GUATONG,,,
278,Pitch Pro Model 8121 Fiberglass Pitching Mound,"Pitch Pro Model 8121 Fiberglass Pitching Mound Model 8121 is the most durable portable 10” pitching mound on the market today. As with all Pitch Pro mounds, our mound support structure is designed to eliminate surface deflection and dead spots, giving pitchers a sturdy landing with every pitch. Model 8121 is ideal for leagues, schools, and facilities designers/managers. Portable 10” game mound Used for distances of 60’6” Unique gel coat-down design is weather and UV resistant Launch Pad included TEN YEAR (10) warranty on mound core! The CHOICE for Rec. Departments, High Schools and Colleges EXTREMELY Rigid Portable (4 person) Room for pickoffs Specifications Weight 425 lbs Dimensions 144 × 96 × 18 in",,
279,Kawasaki Power - Spare Parts - 92145-1687 - SPRING,Kawasaki Power - Spare Parts - 92145-1687 - SPRING,,
280,Dennys Money Pocket Apron,,,
281,"BEZTAT 30mm (6/5"" Inch) Ultra Premium Clear Disposable Tubes w/Red Soft Silicone Grip- 15 Pack, Round Tip (9RT)",,,
282,Siemens 12A 5 5Kw With 1Nc Size S00 24V Ac Power Contactor - 3RT20171AB02,Siemens 12A 5 5Kw With 1Nc Size S00 24V Ac Power Contactor - 3RT20171AB02,,
283,Flag-A-Tag Extra Belts - Set of 6,Steel D-ring belt loops for sizing One size fits most,,
284,Temperature Gauge: 82-89 Camaro,New Camaro Dash Temperature gauge as shown.,,
285,Vacuum Strecher Fracture Protection Air Cushion Body Fixed Airbag for Patient Transport,"Useful for transporting patients over short distances Act as a stretcher Country of Origin : India Manufacturer/Importer/Marketed By : Meddey Technologies Pvt Ltd.C-75, First Floor DDA Sheds, Industrial Area , Phase 1 , Okhla , New Delhi - 110020 , Phone No- +91 8586-012345",,
286,Creme Captain Cook Indústrias Oriol 1942 / 500ml,"Descrição A CREME CAPTAIN COOK de 500ml, da marca INDUSTRIAS ORIOL 1942 SL, é a escolha perfeita para quem busca um toque especial nas suas diversas receitas. Este creme é ideal para cozinhar, realçando o sabor dos alimentos com a sua textura rica e cremosa. Seja para pratos salgados ou doces, o CAPTAIN COOK proporciona versatilidade na sua cozinha. A embalagem de 500ml é conveniente para ter sempre em casa, garantindo que nunca falte este ingrediente essencial para as tuas criações culinárias. Com a garantia de qualidade da INDUSTRIAS ORIOL, este creme vai tornar-se rapidamente um favorito na tua despensa. Características Principais: Quantidade: 500ml Marca: INDUSTRIAS ORIOL 1942 SL Uso Versátil: Ideal para diversas receitas Textura Rica: Cremosa e fácil de trabalhar Especificações EAN: 8423029078812 Formato: Garrafa de 500ml Conservação: Armazenar em local fresco e seco",,
287,(Précommande)Tablier pour enfant avec toque Stitch,"🌊🧁 Des recettes pleines de malice avec Stitch ! Avec cet ensemble Stitch, les enfants de 3 à 8 ans peuvent enfiler leur tablier et leur toque comme de vrais petits chefs… ou comme de véritables petits extraterrestres gourmands ! Idéal pour les ateliers pâtisserie, les anniversaires ou les jeux de rôle à la maison. 🌟 Pourquoi les petits cuisiniers l’adorent ? 🔹 Design Stitch — fun, coloré et 100 % kawaï 🔹 Matière : 100 % polyester — léger, résistant et facile à nettoyer 🔹 Ensemble complet : 1 tablier + 1 toque de chef — pour cuisiner avec style et espièglerie 🔹 Taille recommandée : 3 à 8 ans — parfait pour les petits gourmands en mission sucrée 🔹 Idéal pour les ateliers créatifs, les goûters ou les fêtes à thème 🎁 Un cadeau parfait pour les enfants qui aiment cuisiner, rire… et créer des recettes pleines d’amour et de chaos avec Stitch 🌺✨",,
288,Turning Point Hub Kit #715,"Hub Kit #715 Features: For Yamaha 350 Lifetime Warranty Never buy another hub kit system again Inner splines adapt to the engine Outer hub compatible with different props Reduce gear shock engine/drive damage Save up to 30% when purchasing a replacement prop Eliminate propeller vibration chatter Eliminate hub cracking failure Corrosion resistant materials - brass splines Reduce gear shock engine/drive damage WARNING: This product can expose you to chemicals including LEAD which is known to the State of California to cause cancer, birth defects or other reproductive harm. For more information go to P65Warnings.ca.gov . table.productattributes, .productattributes td { border-bottom: 1px solid #ddd; border-collapse: collapse; padding: 2px; text-align: left; } Truck Freight: No Oversized: No",,
289,Flashcards para Concurso Psicologo da Prefeitura Jacui Mg 2025 - 400 Flashcards de Acordo com Edital,"Flashcards para Concurso Psicologo da Prefeitura Jacui Mg 2025 - 400 Flashcards de Acordo com Edital Está estudando para esse concurso? Aprimore os seus estudos com nossos FlashCards que foram desenvolvidos de acordo com conteúdo de acordo com o edital do concurso. Nossos FlashCards foram criados com o objetivo de facilitar o seu estudo e aumentar suas chances de aprovação no concurso. Tudo é muito simples! Você recebe o link, baixa o arquivo de flashcard no formato .APKG e importa para o seu programa ANKi (que é gratuito), e pronto. Já pode começar a testar seus conhecimentos. São 400 flashcards prontos que englobam questões de todos os tópicos do edital para você aprimorar seus conhecimentos. Nossos flashcards foram desenvolvidos com o apoio da inteligência artificial. Criamos agentes que estudaram diversas provas de concursos anteriores da banca desse concurso, compreendendo profundamente o estilo e as peculiaridades da questões elaboradas. Cruzamos essa informação com o conteúdo pr",,
290,Electric Scooter Xiaomi Electric Scooter 4 25 km/h Black,"Keep fit and discover the sector's latest new releases to perform sports with the best guarantees! Purchase Electric Scooter Xiaomi Electric Scooter 4 25 km/h Black at the best price and enjoy a healthy life! The Xiaomi SCOOTER 4 electric scooter is an advanced urban mobility solution that combines power and range in a durable and stylish design available in black . It features a 300 W electric motor providing continuous power to reach a maximum speed of 25 km/h , ideal for agile and smooth city travel. Its battery has a capacity of 7650 mAh , allowing an approximate range of 35 km per charge , supporting longer trips without frequent recharging. The scooter is equipped with 10-inch wheels front and rear, offering stability and comfort on various urban surfaces. It is designed to support a maximum load of 110 kg , ensuring safety and comfort for most users. Additionally, its robust frame and compact size contribute to versatile handling, while its peak power of 600 W delivers extra per",,
291,High Quality Good Price Office Glass Window Passive Window Tilt-Turn Aluminum Window,"Production Name Passive Window Material Aluminum Alloy(6060-T66) Profile wall thickness 2.0-2.2mm Surface process Powder coating,Wood grain transfer printing Use Occasion All rooms Size Custom Hardware configuration Top Quality Hardware Accessories Packing Tightly packed to prevent any damage Advantage Easy to operate ,Wind resistance, waterproof 1. Q: Who is Warren? What are your main products? A: Warren is one of the biggest windows manufacturers in China, specializing in high-end aluminum windows & doors. 2. Q: Do you have any certifications? A: Yes. We have NAFS/NAMI/NFRC/CSA certifications. Our products can meet North American standards. 3. Q: How long will it take for production? A: It will take around four weeks after receiving your down payment. 4. Q: What is your delivery time? A: 16 days to LA, 26 days to NY, 28 days to Houston. And 30-40 days to other cities in North America. 5. Q: What is your warranty? A: Products covered by Limited Lifetime Warranty(LLW). 6. Q: How to ins",,
292,Clarke & Clarke Haze Denim Fabric Sample F1335/02.CAC.0,,,
293,Night Vision Quilt Pattern Modernly Morgan MM 019,Night Vision Quilt Pattern Modernly Morgan MM 019,,
294,"Hemoton Inflatable Serving Bar Buffet 2 PCS, Drink Bottle Holder Floating Beverage Salad Fruit Serving Bar for Indoor Outdoor Summer Beach Luau Party, Picnic, BBQ, Camping, Water Fun Decorations","About This 【Premium Quality】Inflatable serving bar is made of thickened PVC fabric, abrasion resistant and not easy to, - lasting for and reusable use, safe and no harm for holding drinks and fruits. Just drain, deflate, dry and store it for your next party. 【Keep Cold for Hours】filling ice into the tray you can keep food and drinks cool and fresh for hours. Refrigerate all food in the ice bar, you can more ice to keep cold. Just keep your drinks icy and cold in this summer with our inflatable cooler, allowing you to enjoy a happy summer time. 【Easy to use】The inflatable cooler for parties is designed with 5 cup holders works with party cups, cans, and bottles. Inflate the cooler tray through the air plug at the bottom with pump, quick and safe, wont to air or water leakage, easy operation, sturdy and can be used trustingly. 【Party Delight】Serve as an interesting and festive addition to a summer party, tropical theme party, beach party, pool party or Hawaiian party, etc, letting you pl",,
295,Meguiar's Quik Interior Detailer - 16oz [G13616],"Quik Interior Detailer - 16oz You practically live in your car, and with Meguiar's® Quik Interior Detailer™ you can quickly and easily keep it clean. Quik Interior Detailer™ is the fastest way to safely clean interior plastics, vinyl, leather, rubber, metal, and even LCD and navigation screens. The gentle, high-lubricity formula cleans quickly, lifting off dust, dirt, grime, and spills to restore the original appearance of all interior surfaces. Features: Safely cleans ALL interior surfaces Contains sun-blocking agents to preserve the original appearance Convenient spray-on, wipe-off product that will not leave behind a greasy appearance or feel Improved, deeper cleaning formula Quickly and safely clean interior plastics, vinyl, leather, rubber, metal, and even LCD and navigation screens Gentle, high-lubricity formula quickly cleans, lifting dust, dirt, grime, and spills while restoring the original appearance of all interior surfaces Great for fast touch-ups",,
296,"OFFNOVA Spiral Binding Machine, Spiral Coil Binder with Electric Coil Inserter, Easy to Punch Handle, Adjustable Side Margin, for Letter/A4/A5, Includes 100pcs 5/16"" Plastic Coils & Crimper Plier","About This Electric Coil Binding – OFFNOVA spiral binding machine features an electric coil inserter that effortlessly winds and unwinds coils, saving time and effort. Need to update your documents? Easily remove and replace pages for flexible, personalized binding—perfect for office reports, school projects, and professional presentations. Dual-Arm Punching – Designed with an ergonomic dual-arm handle, this book binder reduces punching effort while increasing efficiency. Punch up to 15 sheets (80g ≤ 20lb) at once and bind up to 500 sheets, making it a game-changer for manuals, brochures, and business proposals. Precision Punching Control – The adjustable side and edge guide in this binding machine spiral coil binder ensures accurate punching for Letter (44 holes), A4 (46 holes), and A5 (34 holes) paper sizes. Customize margins from 2.5mm to 6.5mm for professional-quality planners, notebooks, and reports. Pre-Assembled & Durable – Unlike other binding machines, this coil binding machin",,
297,"DryLine Grip Correction Tape, Non-Refillable, Gray/Green Applicator, 0.2"" x 335""","Paper Mate Liquid Paper DryLine Grip Correction Tape lays down smoothly and corrects instantly--no drying necessary. Ideal for correcting single or multiple lines, this strong polymer-back tape quickly fixes mistakes without making a mess. This correction tape resists breakage and tearing, allowing you to neatly correct long passages of text. It also applies dry, so you can copy, fax, edit, or type immediately after application.",,
298,"6pcs Walking Stick Tips, Replacement Rubber Tips for Walking Sticks, Trekking Pole Tips Baskets Hiking Pole Tips Feet Shock Absorption Rubber Cane Tips 11mm Diameter Survival Hiking Stick Accessories","About This EXTRA PROTECT: Walking stick, trekking poles, hiking poles rubber tips used for adding extra grip and traction on varies terrain, rubber walking stick tips are essential hiking accessories to ensure body balance when survival, hiking, walking or climbing outdoor UNIVERSAL RUBBER TIPS REPLACEMENT: Our rubber tips for walking sticks design with standard diameter of 11 mm / 0.43 inch, these pole tips will fit perfect for most brands walking sticks, these rubber tips are great replacement of walking sticks tip, trekking pole tip, hiking sticks feet, cane tips, crutch tips, ski poles tip SAFETY: Our walking stick rubber tips made of high quality rubber with embedded metal washers, these rubber walking pole tips will greatly protect the tungsten carbide tips of your expensive trekking poles and prolong your trekking stick using time ALL TERRAIN: These trekking poles tips can be widely used for any terrain, especially rocky, gravel, mud, sand, rain, snow or other harsh terrain. Hik",,
299,Unisex windbreaker,"Whether you’re hiking, camping, or just running errands, this casual, sporty windbreaker’s got you covered. It’s very lightweight, durable, and water-repellent. This unisex windbreaker has a zipped closure and elasticated cuffs for a snug fit and comfortable wear. It also has two zipped pockets to store your essentials while on the move. This classic windbreaker will keep you both fashionable and protected on all your adventures. • 100% polyamide • Fabric weight: 7.13 oz./yd.² (202 g/m²) • Regular fit • Hood with a drawstring, zipped closure, elastic cuffs and hem • 2 zipped pockets • This product’s fabric is OEKO-TEX Standard 100 certified and PETA-Approved Vegan This product is made especially for you as soon as you place an order, which is why it takes us a bit longer to deliver it to you. Making products on demand instead of in bulk helps reduce overproduction, so thank you for making thoughtful purchasing decisions!",,
300,New York Mets - Elan Deluxe Corkscrew In Bamboo Box,"It's the details that make the difference - The Elan Corkscrew is a stainless steel waiter-style corkscrew with an eco-friendly bamboo handle and bamboo box with a hinged door. No more fishing around in your drawer for the wine opener, this corkscrew set sits elegantly on your bar top for your guests to admire.",,
301,Helikopter Bell 206 Jet Ranger,"Die Bell 206 Jet Ranger ist eine Hubschrauberfamilie des US-amerikanischen Herstellers Bell Flight. Sie ist der kommerziell erfolgreichste Zivilhubschrauber. Wissenswertes Bell Helicopter USA / Canada (Hauptsitz in Fort Worth, Texas, USA) hat seit 1967 mehr als 6'300 Stück des Bell 206 in verschiedenen Varianten verkauft. Helikoptertyp (je nach Standort abweichend) Bell 206 Jet Ranger III Einsatzbereich: Passagiertransporte, Überwachungsflüge, Film- und Foto Flüge, Vermessungsflüge, Schulung Hauptrotordurchmesser: 11,28 m Leergewicht: 903 kg Max. Startgewicht: 1452 kg Sitzplätze: 5 (4 PAX + 1 Pilot) Reisegeschwindigkeit: 190 km/h Höchstgeschwindigkeit: 240 km/h Dienstgipfelhöhe: 4'114 m ü. M. (Dichtehöhe) Antrieb: Gasturbine vom Typ Rolls Royce Allison 250C-20B, Max. Leistung 309 kW (420 PS) Treibstoff: Jet A1 (Kerosin)",,
302,FUJIFILM FT-XH File Transmitter Grip,"FUJIFILM FT-XH File Transmitter Grip The FT-XH File Transmitter Grip vastly improves the networking capabilities of the camera. It has fast Wi-Fi connectivity, with speeds up to 600 Mb/s, along with wired LAN connectivity for in-studio tethered shooting. Remote recording by wired LAN or wireless LAN; capable of controlling up to four X-H2S cameras from a browser at the same time The file transmitter also brings the usual benefits of a battery grip, such as shooting in the vertical orientation and being able to accept two additional NP-W235 rechargeable lithium-ion batteries to increase shooting capacity. In terms of its physical design, the extended shape incorporates a secondary shutter release button as well as a focus lever, AE-L button, AF-ON button, front and rear command dials, and Q button to mimic the camera's own layout for intuitive handling. The file transmitter also brings the usual benefits of a battery grip, such as shooting in the vertical orientation and being able to a",,
303,Solar System,"Completed Size:18"" W x 17.5"" H on 14ct. Stitch Count: 249w x 243h. Floss: 51 DMC Cotton Colours. Original image courtesy of NASA search-split, 1156, Stars, Celestial",,
304,Free Cosmetic Concept Mock-Up Psd,We deliver staggering free mockups that save you time and money and this time we thought to delight you big time with the best free cosmetic concept mock-up psd. Applications Supported Adobe Photoshop File Types PSD License Free to Use (see source for details) Source Freepik Free Download,,
305,Mr Zogs Quick Humps Sex Wax,"Sexwax Quick Humps surfboard wax formulas are the ""go to"" choice for professional and experienced surfers around the world, now packaged in recyclable paperboard boxes. This new package is easy to open and can be reused to keep your leftover or partially used wax clean in its original package. Find the ideal balance between stability and stickiness by utilizing these formulas alone or as part of a Basecoat/Topcoat combination. 1-X YELLOW LABEL REVISED RANGE X-COLD to COLD 58°F / 14°C & BELOW 2-X PURPLE LABEL REVISED RANGE COLD TO COOL 48°F to 68°F 9°C to 20°C 3-X GREEN LABEL REVISED RANGE COOL TO MID WARM 58°F to 74°F 14°C to 23°C 4-X ORANGE LABEL REVISED RANGE MID COOL TO WARM 64°F to 78°F 18°C to 26°C 5-X RED LABEL REVISED RANGE WARM TO MID TROPIC 70°F to 84°F 21°C to 29°C 6-X BLUE LABEL REVISED RANGE TROPIC 78°F / 26°C & ABOVE (Base coat) SINGLE WAX OR BASECOAT/TOPCOAT? WHAT IS THE DIFFERENCE BETWEEN HARD & SOFT WAX? Softer waxes will be: Stickier Easier to apply More likely to move",,
