product_id,title,description,brand,category
133,"Wright Products™ V1020BL Standard Duty Pneumatic Door Closer, Black Finish","This standard duty closer can be mounted on all out swinging storm or screen doors either as a single closer for light or medium weight doors, or paired with another standard duty closer (one mounted at the top and the other at the bottom of your door) for heavier full view storm doors. This closer has a full 90 degree opening range, is factory lubricated and has an adjustable closing speed. Finish : Black For out swinging wood or metal doors Full 90 degree opening Adjustable closing speed Factory lubricated Two hole end plug for adjustable latching power Use alone for light and medium weight doors or in pairs for heavier full view storm doors All installation hardware included.",,
134,"Solder-It - Butane Touch - Contains Mini Torch, Extended Nozzle & Refillable Fuel Cell",Item #: 81509408 Brand: Solder-It Model #: MJ-310 Exact Tooling IR#: 04 Product Specifications Type Butane Contents Mini Torch; Extended Nozzle; Refillable Fuel Cell,,
135,Aiphone - GF-2P 2-CALL BUTTON PANEL,2-Call button panel for GT-SW Features Two-call button panel for GT-SW Specs Material Zinc die cast,,
136,Zebra MC9400/MC9450 Ultra-Rugged Android Mobile Computer 2D Barcode Scanner,"Unveil the power of the new Zebra MC9400/MC9450, an ultra-rugged Android mobile computer featuring a 2D barcode scanner and enhanced wireless connectivity for demanding environments. Overview: Introducing the Zebra MC9400/MC9450 Ultra-Rugged Android Mobile Computer , a state-of-the-art device engineered for the toughest industrial conditions. This mobile computer combines a high-performance 2D barcode scanner with advanced wireless connectivity, making it an ideal choice for logistics, manufacturing, and warehousing operations. Product Description: The Zebra MC9400/MC9450 is designed to enhance productivity and streamline operations in extreme work environments. It offers robust construction, superior scanning capabilities, and the intuitive usability of Android, tailored for the needs of workers who require reliability and speed. Key features include: 2D Barcode Scanning: Delivers fast and accurate data capture to keep inventory and asset management efficient. Android Operating System",,
137,HYPERFX Peg Board,HYPER FX Peg Board,,
138,"Korean Exfoliating Mitt - Exfoliating Gloves 3 Pack - Exfoliating Body Scrubber, Viscose Fiber Body Scrub Gloves, Dead Skin Remover for Smoother Skin, Self-Tan Prep & Removal","About this item Achieve Glowing Skin: Use the THURLADY exfoliating glove to gently and effectively remove dead skin cells, leaving your skin feeling softer and smoother. It also helps reduce lumps and ingrown hairs, and improves the absorption of skincare products. Suitable for all skin types, without irritation Deep Exfoliation: The THURLADY Korean exfoliating mitt is rough enough to be effective, yet soft enough to be comfortable. More effective than loofah and body scrub. Using this Korean scrub mitt weekly cleans pores and removes trapped dirt and oil, which can help prevent body acne and keep skin fresh Self-Tan Prep & Removal Tool: These exfoliating gloves are not only great for daily shower exfoliation, they are also perfect to help buff out faded self-tanners! Reveal even skin tone underneath without being too harsh on your skin Quick Drying and Reusable: These body scrub gloves are double-hemmed with premium, natural, eco-friendly viscose fibres. Once wet, the unique plant-bas",,
139,Gazebo Weight Plates 4 pcs Black 220x50 mm Concrete,"Our 4 pieces of weight plates will provide a cost-effective option for safely securing your gazebos, party tents, outdoor parasols or any other outdoor equipment. Made of concrete inside and covered with plastic, these base weights are durable and weather resistant. Each weight is suitable for the tube size up to 30 mm. This set of weights can be stacked on top of each other to prevent your tent topple or fly away in high winds. Our gazebo weight plates are easy to use and transport. Colour: Black Material: Concrete with plastic cover Dimensions: 220 x 50 mm (Diameter x H) Suitable for 30 mm tube Weight (each): 3.25 kg Easy to use and transport Delivery includes 4 weight plates",,
140,MTD Troy Bilt Tiller Gear Kit Replacement,"Looking to keep your MTD Troy Bilt Horse Tiller running smoothly? The munirater Tine Shaft Gear Bearings Races Spacers Key Worm Gear Kit Replacement is here to save the day! This high-quality kit from munirater is designed to provide a perfect fit and reliable performance for your beloved tiller. Crafted with precision and durability in mind, this replacement kit includes everything you need to keep your tiller in top condition. The kit features high-quality components such as bearings, races, spacers, key worm gear, and more, ensuring that your tiller functions seamlessly and efficiently. Say goodbye to worrying about worn-out or malfunctioning parts on your tiller. With the munirater Tine Shaft Gear Bearings Races Spacers Key Worm Gear Kit Replacement, you can rest assured that each component is built to last and deliver optimal performance. Installation is a breeze, thanks to the user-friendly design of the kit. Simply follow the included instructions, and you'll have your tiller up",,
141,"Detector de metale, reperare de precizie, portocaliu","Acest detector de metale cu reperare de precizie este ideal atât pentru scopuri profesionale, cât și pentru cele private, datorită tehnologiei sale inteligente de căutare. Poate fi folosit pentru a localiza toate tipurile de metale, inclusiv fier, argint, cupru, etc. Operare ușoară: Este simplu de operat și poate fi folosit pentru a localiza metale precum fierul, argintul și cuprul, cu caracteristica sa de înaltă sensibilitate. Are un buton de pornire/oprire ușor de utilizat și este, de asemenea, ușor în greutate. Când este detectat un obiect metalic, acesta va genera sunete și va vibra. Echipament frumos: Echipat cu o lanternă încorporată și alimentat de o baterie de 9 V (nu este inclusă). În plus, are memorie, care păstrează setările curente chiar și atunci când alimentarea este oprită, eficientizând experiența utilizatorului prin eliminarea nevoii de reconfigurare la fiecare utilizare. Bine de știut: Utilizarea unui detector de metale poate necesita o permisiune, un permis sau o lic",,
142,Baxton Studio Henry Modern and Contemporary Grey Fabric Upholstered and Dark Brown Finished Wood 5-Piece Dining Set,"Update your dining space with the contemporary style of the Henry dining set. Made in Malaysia, this set includes four chairs and one table constructed from sturdy wood in a dark brown finish that complements the light fabric upholstery. A splendid balance of both comfort and style, the Henry features a plush foam-padded seat, as well as a unique cut-out design on its back. Requiring assembly, the large rectangular tabletop allows ample elbow room for each member of the table. Whether it's for casual meals or formal scenarios, the Henry dining chair easily modernizes any dining space.",,
143,"RIM 140-14 EXCEL 32 HOLE, ERBBS431","nan All items shipped to the USA will be subject to import tariffs, which must be PAID BY THE BUYER .",,
144,QuadBoss 88-00 Honda TRX300FW FourTrax 4x4 Front Differential Bearing & Seal Kit,"QuadBoss 88-00 Honda TRX300FW FourTrax 4x4 Front Differential Bearing & Seal Kit This Part Fits: Year Make Model Submodel 1988,1990-2000 Honda TRX300FW FourTrax 4x4 Base 1998-1999 Yamaha YFM350FW Big Bear 4x4 Base 2000-2001 Yamaha YFM400 Big Bear 4x4 Base 1999 Yamaha YFM400F Kodiak 4x4 Base",,
145,02470 BALL BEARING 5X10X4,Use for LOGO 400 / LOGO 400 SE / LOGO 500 / LOGO 700 XXTREME / LOGO 800 XXTREME Specifications: Ball bearing (5x10x4) x 2,,
146,STIHL AXE - Splitting Axe - AX 28 CS - 2800g,"Splitting Axe - AX 28 CS - 2800g 80cm, 2,800g. With hickory handle, impact protection sleeve and safety plate. Highly suitable for easy, splitting work.",,
147,Cute LED Ghost Night Light Children's Nightlight Gift Bedsid,"Illuminate Your Child's Night with a Cute LED Ghost Night Light Welcome to the enchanting world of nocturnal comfort, where the cute LED ghost night light brings a delightful glow to your child's bedroom. This whimsical nightlight is not only adorable but also designed to create a soothing atmosphere that helps your little ones drift into a peaceful sleep. With its charming ghost design, it becomes a trusty companion that wards off nighttime fears, making bedtime a delightful experience. Why Choose Our Cute LED Ghost Night Light? Every parent knows how essential it is to create a relaxing and comforting environment for their children. The cute LED ghost night light serves as more than just a decorative piece; it helps instill a sense of security and relaxation, encouraging your child to sleep soundly through the night. Adorable Design: Delightfully crafted to resemble a ghost, this nightlight adds a playful touch to any kids' room. Soft Glow: The gentle illumination provides just the r",,
148,"RAK Washington White Close-Coupled Toilet Suite, Alpine White with P-Trap","Traditional, vintage style Boxed rim pan Concealed pan for easy cleaning UF soft close seat High quality, Geberit flush mechanism Left OR right bottom inlet Stainless steel hinges Includes concealed floor fixing screws WELS 4 Star - 4.5L/3L (3.4L avg/flush) WELS Registration: L01764",,
149,Bell Sports Stopper 300 4-Patch Bicycle Tube Repair Kit,"Everything needed to patch a leak on a tube or other inflatable item Small patches for small punctures Large patch can be cut to shape for larger holes Includes vulcanizing glue, metal scuffer, (3) 1 In. x 1 In. and (1) 2 In. x 3 In. rubber patch",,
150,Portable Mini Foldable Washer and Spin Dryer,"Experience convenience and efficiency with our Portable Mini Foldable Washer and Spin Dryer. This compact and versatile washing machine is perfect for small apartments, dorm rooms, travel, and camping. Key Features: Compact Design: Easily foldable, this washer and dryer combo can be stored in small spaces, making it perfect for those with limited space. Easy to Use: Simple operation with a user-friendly interface allows you to wash and spin-dry your clothes quickly and effortlessly. Versatile Cleaning: Suitable for a variety of garments including delicate fabrics, baby clothes, and small loads. Energy Efficient: Consumes less water and electricity compared to traditional washing machines, helping you save on utility bills. Durable Material: Made with high-quality, durable materials to ensure long-lasting use. Specifications: Capacity: Ideal for small loads and delicate items. Power: Low power consumption for energy efficiency. Portability: Lightweight and easy to carry, making it perfe",,
151,GLUVIT 2LB QUART,Give your boat hull or deck a water-tight seal that flexes with your hulls movements with the Gluvit Epoxy Sealer by Marine-Tex. Gluvit barrier coat seals and protects hulls and decks. With this expoxy you ll provide superior protection seal leaky seams and rivets in aluminum hulls and leaks around fiberglass cabins or decks. Hard protective coating flexes with hull movements to bridge and seal hairline cracks. Gluvit fills minor cracks and pinholes. Its long working time allows penetration into cracks to seal and strengthen. Its barrier coat to minimizes water absorption and galvanic corrosion. Simply renew deterioration with a few strokes. On wooden hulls Gluvit seals and protects planks and sheeting against water absorption and damage from marine parasites. On aluminum hulls Gluvit seals seams and rivets and acts as a barrier coat to minimize galvanic corrosion. For maximum ultraviolet protection Gluvit must be painted after full cure. Gluvit can be overcoated with any marine paint ,,
152,Solo Stove - Campfire kooktoestel,"Campfire kooktoestel Compact kampeerfornuis. Lichtgewicht, compact en innovatief ontwerp. Essentieel voor elke ""ontdekkinsreiziger"". Levenslange garantie.",,
153,My First Pickle Ball Set,My First Pickle Ball Set,,
154,"Cheese Shakers, 6 oz - perforated - 1 each - G107 NRE # 012164","Cheese Shakers, 6 oz perforated 1 each NRE # 012164 Winco # G107",,
155,Classic Loomis Gag Browband Twisted Wire Snaffle,"Loomis Gag bits can be used for everything from starting colts to tuning seasoned finished horses. Perfect transition to use directly following the ring snaffle by giving the rider lift and sharpness, which makes it easier to progress the young horse into side-passing and reverse-arc maneuvers. Excellent for teaching a colt to be collected and helps the rider to effectively communicate neck and body flexion. Popular training tool for barrel racing, reining, cutting, and endurance riding. The browband style is available in a smooth or twisted mouthpiece. Durable nylon cord cheek pieces, stainless steel hardware on double stitched natural leather headstall with dots. Ready-to-use, all you need are reins.",,
156,250ml storage bottle with brush,"About the item A 250ml storage bottle with brush is a convenient container equipped with an integrated brush for easy application and storage of liquids such as sauces, oils, or cleaning solutions.",,
157,Thread Snips - Bronze Bamboo Tiny Scissors,"Just what you've been asking for! Ultra sharp and beautiful thread snips! These bronze bamboo tiny scissors are perfect in every way! Ultra sharp point and blades Cuts easily through fiber thick or thin Easily fits inside our large slider tins Measures - 2 3/8"" x 1 1/2"" (60mm x 38mm) Inner handle loops measure - 1 1/8"" x 1/2"" (29mm x 13mm)",,
158,GREEN VALLEY CREAMERY SOUR CREAM LCF ORG - 12 OZ,"Discover this high-quality product, designed to meet your everyday needs. Made with natural and wholesome ingredients, this item offers exceptional value and performance. Whether you are using it for home or for a special occasion, you can count on its superior quality. We are committed to providing the best products, and this item is no exception. Its versatility and reliability make it a perfect addition to your pantry or household. Enjoy the great taste and convenience of a product you can trust. Stock up on this essential item today!",,
159,2024 KT GINXU DRAGONFLY 2 FOIL BOARD,"GINXU DRAGONFLY 2 Sup Downwind Foilboard Pro Carbon. Step Bottom Downwind Sup, All-Around, Lightwind Wingfoil Better glide and quicker takeoff, same original Ginxu Dragonfly DNA. The original Ginxu Dragonfly performed so well as a crossover for downwind paddling and winging in the lightest of breezes, we simply couldn’t beat it. Generation 2 thus stays true to the DNA of the original, with slight tweaks in hydrodynamic flow out the tail and a repositioned Ginxu Step Bottom (patented), for better glide and quicker takeoff. Available in 88, 95, 100, 105, 110, 121, 135 liters. Revolutionary Seamless Form KT Technology, all new ultra faithful representation of the original shape, more precise than conventional CNC or mold process. Full Carbon Hull, connecting deck, bottom and rails, for all encompassing lightning fast response and supreme stiffness. US track boxes: 2x 13”. Soon available to pair with genuine KT foils, developed by Kane de Wilde (@kdmaui) and Jason Diffin (@jasondiffin). Al",,
160,Tough-1 1200D Tooled Leather Print Turnout Sheet with Snuggit,"This classy, tooled leather print from Tough1 looks just like the real thing! Made with a 1200 denier waterproof ripstop outer shell, this sheet features the Tough1® Snuggit™ strap which offers a more adjustable fit around the neck. The large shoulder gussets allow the horse freedom of movement and three dee rings at the neck offer optional neck cover attachment. The double buckle front closure design includes removable snaps and a “Quick Grip” tab for extra security. Other features include: fleece wither protection, tail flap, crossed surcingle straps with elastic ends, and adjustable/replaceable elastic leg straps",,
161,"Poly-Riser 48"" x 23"" Panel Riser","Poly-Riser 48"" x 23"" panels provide a 1-3/4"" height with a conventient flow-through grid design allowing workers to keep safely out of hazardous solvents, chemicals, and wet conditions. Build out horizontally with additional Poly-Riser panels to fit almost any space. No-tool assembly allows for easy modification and clean up of the work area. Made from UV protected high-density polyethylene, Poly-Riser is good for indoor or outdoor use. Can be cut to size with a circular saw or handsaw.",,
162,Security Unlock Fingerprint Padlock,"Unlock with Ease: Security Unlock Fingerprint Padlock Enhance your security with the Security Unlock Fingerprint Padlock, designed for convenience and safety. Perfect for securing lockers, bikes, backpacks, and more, this padlock offers advanced fingerprint technology for quick and reliable access. Advanced Security: Security Unlock Fingerprint Padlock Experience the peace of mind with the Security Unlock Fingerprint Padlock, featuring cutting-edge biometric technology that ensures only authorized users can unlock it. Say goodbye to forgotten combinations or lost keys with this state-of-the-art security solution. Durable and Weather-Resistant: Security Unlock Fingerprint Padlock Enjoy durability and reliability with the Security Unlock Fingerprint Padlock, crafted from high-quality materials to withstand various weather conditions. Ideal for both indoor and outdoor use, this padlock provides robust protection wherever you need it. Easy to Use and Manage: Security Unlock Fingerprint Pad",,
163,General 523 Adjustable Trammel,"The #523 adjustable trammel is ideal for transferring measurements, scribing arcs and drawing large circles. It accurately measures and marks distances beyond range of conventional compasses and dividers. Unit: EA UPC: 038728230935 Model Number: 523",,
164,The New Weissenborn Method for Bassoon,,,
165,Perfect Jump Shot Strap (Off Hand),"How to Perfect Your Child's Shot , Automatically! Just Put on the Perfect Jump Shot Strap & Start Shooting... No Coaching Needed! window.SHOGUN_IMAGE_ELEMENTS = window.SHOGUN_IMAGE_ELEMENTS || new Array(); window.SHOGUN_IMAGE_ELEMENTS.push({ hoverImage: '', uuid: 's-26e2d167-5718-4069-b0bb-a8ce042316d8' }) window.SHOGUN_IMAGE_ELEMENTS = window.SHOGUN_IMAGE_ELEMENTS || new Array(); window.SHOGUN_IMAGE_ELEMENTS.push({ hoverImage: '', uuid: 's-b490238f-eb7d-495b-96af-b5a2e2afc03d' }) Unlock the secret to flawless shooting mechanics with the HoopsKing Perfect Jump Shot Strap, the ultimate off-hand basketball shooting aid designed for players determined to refine their shooting skills. Overcome the common hurdle of correcting shooting habits efficiently and transform your gameplay. Achieve Precision in Every Shot The Perfect Jump Shot Strap targets the persistent issue of thumbing the basketball with your off hand, a habit responsible for countless missed shots. With this innovative tool, b",,
166,Bartnelli Rorets leg pin for ironing board,Bartnelli Rorets leg pin for ironing board fits models 2615 - 9738 - 4815,,
167,Dualtron Spider (Pre-order),"Dualtron Spider The Dualtron Spider represents a significant leap forward in the innovation of electric scooters. Until now, choosing an escooter meant one had to choose between power and portability. However, this engineering marvel by Minimotors has completely changed the game. It is an extremely powerful electric scooter with its speed maxing out at 65km/h. With such power, scooters tend to be heavy, but this dual motor e-scooter only weighs 20kg, making it one of the most lightweight and powerful scooters in the world. By using an aerospace aluminium alloy for its frame, dual BLDC magnesium motors and a carbon fiber handlebar, Minimotors managed to keep the weight of this scooter incredibly light. Customizing the suspension on your Dualtron Spider to your preference is also easy with the optional replaceable rear suspension cartridges. The Spider comes stock with medium cartridges, but there are two softer and two firmer cartridges to choose from. SPECIFICATIONS Model Dualtron Spid",,
168,STIHL PAN HEAD SELF-TAPPING SCREW (9075 478 4085),"STIHL PAN HEAD SELF-TAPPING SCREW (9075 478 4085) Pan Head Self- Tapping Screw IS-D5x18 FITS SP 200, MS 171, MS 181, MS 181 C, MS 171, MS 181, MS 181 C, MS 271, MS 271 C, MS 291, MS 291 C, MS 271, MS 271 C, MS 291, MS 291 C, HS 45, MS 270, MS 270 C, MS 280, MS 280 C, MS 231, MS 231 C, MS 251, MS 251 C, MS 211, MS 211 C, SP 400, SP 450, MS 211, MS 211 C, HS 46, HS 46 C, HS 56 C, HS 46, HS 46 C, HS 56 C, MS 270, MS 270 C, MS 280, MS 280 C STIHL recommends using only STIHL Genuine replacement parts for the repair and maintenance of your STIHL equipment. We want every STIHL owner to have the best product performance possible, so if you are in need of STIHL repair or equipment maintenance, Stihl genuine parts are the way to go. PARTS Need spare parts for your motorcycle, mower or power equipment? We stock a wide range of parts for Australia’s leading brands like John Deere, STIHL, Suzuki, Walker Mowers, Bobcat Mowers, Royal Enfield, Masport, Rover, Segway Powersports and Rieju. Get in touch",,
169,SPIDER BROOMBALL,"SPIDER: Indoor/outdoor professional level game ball, Approved by the USA Broomball Federation. High quality condensed imported latex foam shell. Exclusively made for use on ice-field to withstand extremely cold conditions. Low bounce responsive touch provides superior trajectory and flight during play. Official size and weight",,
170,Solarix LED Solar FloodLamp Orange Large Size,,,
171,Armário de Cozinha Compacta 6 Portas 105 cm Cinza Márcia,"Armário de cozinha compacto e resistente, ideal para organizar ambientes menores. Produzido 100% em MDP com pintura UV na cor cinza, conta com 6 portas para armazenar utensílios do dia a dia e pés em PVC para estabilidade. Design clean e funcional para deixar sua cozinha prática e bonita. Marca AJL Móveis Linha/Modelo Márcia Material Principal MDP (100%) Acabamento Pintura UV Cor Cinza Quantidade de Portas 6 Quantidade de Gavetas Não possui Quantidade de Prateleiras Não possui Pés Sim (PVC) Altura 177,5 cm Largura 105 cm Profundidade 38 cm Peso 40 kg Tipo Cozinha compacta Ambiente Principal Cozinha Necessita Montagem Sim (montagem não inclusa) Limpeza Usar pano macio; evitar abrasivos Condição Novo Garantia Não informado pelo fabricante",,
172,Oben QR-10 Quick Release Plate,"Oben QR-10 Quick Release Plate The Oben QR-10 Quick Release Plate is a camera plate that fits the Arca Swiss- style quick-release element of Oben's BB-0, BB-0T, BC-0 & BC-0T ball head models. The plate features a 1/4""-20 screw with a ring on the underside that allows you to attach it to a DSLR, point & shoot, or video camera without using tools. For camera stability, the top of the plate features a rubberized surface. Two studs on the bottom of the plate help prevent the camera & plate from sliding all the way forward or backward out of the ball head, in case the head's clamp is inadvertently left loose.The plate is 1.95"" (49.5 mm) long, and fits any standard Arca-type quick release mechanism. Product Features Fits Oben Ball Head Models BB-0, BB-0T, BC-0 & BC-0T 5-Year Warranty",,
173,EXTRACTOR DE AIRE,¿Estás buscando una solución eficiente para mejorar la ventilación en tu lugar de trabajo? ¡Entonces estás en el lugar correcto con nuestro extractor de aire DTF. Características: Peso: 18kg. Extrae y filtra el aire. Ruido: Menos de 45 db. Tamaño: 425*240*410 cm. AC220 v 50 hz Power 130 w. Versatil para cualquier secador. Filtración: 280m 3/h - 0.3um 99.99 %.,,
174,Vaso de Entrenamiento,Aprender a beber bebidas puede ser un desafío para tu bebé. Vaso con agarraderas en ambos extremos que lo hacen práctico y más fácil de dominar. Hecho para evitar derrames.,,
175,6 Pole Wind Break,"Features: High Quality Lightweight Ideal for Camping, the beach, picnics, garden and more Strong and Durable Colourful design Easy to erect - push poles into ground or sand, or use a rubber mallet for harder ground Multiple sizes available 95gsm Polyurethane Product Specification: 336cm (L) Fabric Height: 115cm Pole Height: 145cm",,
176,Wind Up Chick Play Toy For Kids,Bachaa Party brings you the best price for Wind Up Chick Play Toy For Kids with express shipping all over Pakistan. Product Detail: It will surprise kids when you wind up the Chick and stand it up anywhere there is a smooth surface The toy highly restores every detail improve experience touched hand brain Imported Toy suitable for playing & desktop Non-toxic & durable plastic Outstanding Design Chick Size: H''' 3.7 inches W'' 3.4 inches,,
177,Walthers Scenemaster 1/87 HO Dry Bulk Semi Trailer Theobroma Cocoa 949-2625,"Adult collectible, NOT a toy Die cast & plastic replica, Approximately 5.75"" long. We are not responsible for any taxes, duty, VAT, customs or other fees on the receiver’s end. Check out our other items and save on shipping! To receive combined shipping, place the items you wish to purchase in your cart, discounted shipping will be automatically calculated at checkout. Please complete all your shopping before checking out, we cannot combine shipping on separate orders. Sorry, no shipping refunds can be given for combining separate orders.",,
178,Flower Power Hippie Costume 12-14,"Flower Power Hippie Costume 12-14 Costume Includes Headband, Top & Bell Bottom Pants",,
