product_id,title,description,brand,category
1,Airplane Piggy Bank,The sweetest gift!,,
2,PostuEase™ - Justerbart hållningsbälte för ryggen,"Förändra din hållning, lindra smärta och återfå självförtroendet! Orsakar sned rygg obehag och påverkar ditt självförtroende? Längtar du efter en lösning som kan lindra belastningen på rygg och axlar? Tänk dig att stå rakryggad och stolt, fri från bördan av dålig hållning. Är det inte dags att omfamna ett liv utan de begränsningar som slokande hållning innebär? PostuEase™ erbjuder omfattande stöd och korrigering för både män och kvinnor, främjar korrekt ryggradsinriktning och minskar belastningen på ryggmuskler och axlar, vilket resulterar i en revitaliserad hållning. Fler anledningar till varför våra kunder älskar PostuEase™: ✔️Lindra smärta: Säg adjö till ryggvärk och obehag med vår PostuEase™ hållningskorrigering. Den justerbara designen ger riktat stöd för att lindra smärta orsakad av dålig hållning. ✔️Förhindra slokande: Få slut på slokande och förbättra din hållning utan ansträngning. PostuEase™ drar försiktigt axlarna bakåt och hjälper dig att bibehålla en hälsosam och upprätt p",,
3,Panama Man,"Description The refined tradition of Italian tailoring by 100% Capri meets the sophisticated elegance of French craftsmanship in the creation of the iconic Panama hat. Expertly handwoven from premium natural straw , the Panama Man hat acquires its distinctive shape through careful pressing and steaming techniques. Flexible yet firm in style, this accessory is finished with an elegant cotton grosgrain ribbon , emphasizing the timeless and exclusive design synonymous with the 100% Capri brand. 95% Straw / 5% Cotton Care and Maintenance: USE a soft brush to dust off / DO NOT get it wet / after use STORE in the 100% Capri case. Sustainable Product Made in France Packaging and Shipping Shoppers, hat-boxes shoppers, and garment bags, whereas necessary,are entirely realized with 100% finest linen, respecting 100% Capri environmental sustainability philosophy.",,
4,Column capital KK13,"Elevate your column's beauty with our exquisite Column capital KK13. This decorative element adds sophistication and refinement, transforming your column into a stunning focal point. Precision-crafted and artistically designed, our column capital encapsulates the timeless elegance of classical architecture, enhancing the aesthetic appeal of any space.",,
5,Conn 62HI Bass Trombone Outfit Independent Valves,Conn 62HI Bass Trombone Outfit Independent Valves,,
6,Premier Soccer,"Master the essentials for winning soccer from one of the game's most successful coaches. In Premier Soccer, Michael Parker, the wins leader among active NCAA Division I men's soccer coaches, teaches every key technique and tactic, with accompanying drills and special tips for executing them when the match is on the line. Premier Soccer tackles the skills and traits necessary for each position on the field, both offensively and defensively, as well as systems, set plays, restarts, and practice drills. With an emphasis on player development, on-field awareness, conditioning, and team play, Parker reveals his proven approach to team and player success. Whether you are a player or coach, this is your guide to consistent and winning play at every level of competition.",,
7,Vishay LED Displays TDSG1160,"Vishay, TDSG1160 Vishay 7-Segment LED Display, CC Green 6 mcd RH DP 7mm",,
8,"SOG SEAL XR 3.9"" Folding Pocket Knife (Blackout)","SOG SEAL XR 3.9"" Folding Pocket Knife (Blackout)",,
9,Florida Gators PS5 VarsityWrapz,"Florida Gators PS5 Console Skin Officially licensed Florida Gators PS5 wrap – precision fit, vibrant orange and blue design, and durable vinyl protection for your PlayStation 5 Disc or Digital Edition. Features 🐊 Perfect fit for PS5 Disc and Digital models with full port access. 🛡️ Protects from scratches, dust, and fingerprints. 🎨 Bold University of Florida colors and Gators logo. ⚡ Easy bubble-free application and residue-free removal.",,
10,"Konper Original Large Music Stand. Compatible with Yamaha PSR/YPT/KB/P/DGX Series Keyboard Music Score Stand, Keyboard Sheet Music Stand with 4 Music Book Clip",,,
11,HP1044 SAUER TUROLLA PUMP,"HP1044 Hydraulic pump is an original Danfoss© part produced in Germany. It has been engineered to superior standards, and is compatible with Sandvik© original specifications. HP1044 Sauer Turolla Pump is a reliable and efficient hydraulic pump designed for optimal performance in demanding industrial environments. With its precision engineering and durable construction, it delivers consistent hydraulic power to meet the needs of various applications with reliability and longevity. The unit weight is 12.5kg. HS code 8474909000. Continue exploring our store, for more PEAK quality parts!",,
12,"9641620A 4-Piece Kit A/C Compressor, With Clutch, 6-Groove Pulley, 2.4L, 4Cyl, GPD A/C Compressor, Includes (1) A/C Compressor, (1) A/C Expansion Valve, (1) A/C O-Ring and Gasket Seal Kit and (1) A/C Condenser",Specifications Type A/C Compressor OE number 10670 Quanity sold Sold Individualy Product Fit Direct Fit Vehicle Fit 2011HyundaiSonata(GL) 2011HyundaiSonata(GLS) 2011HyundaiSonata(Limited) 2011HyundaiSonata(SE) 2011KiaOptima(EX) 2012KiaOptima(EX) 2011KiaOptima(LX) 2012KiaOptima(LX),,
13,PHILIP PN SMS Z 10X7/8,"Brand Name: HILLMAN Callout Size: No. 10 Color: Silver Container Size: Finish: Zinc-Plated Head Type: Pan Length: 7/8 Packaging Type: Boxed Point Type: Sharp Product Type: Sheet Metal Screws Self Drilling: No Self Tapping: Yes Sub Brand: Thread Type: Coarse Drive Style: Phillips Indoor or Outdoor: Indoor Material: Steel Number in Package: 100 Usage: Wood, Fiberglass and Metal",,
14,Vortex RL210 Black 1 Bar Roof Rack,"Utilising our highly regarded Vortex bars, this system offers you compatibility with a wide selection of Rhino-Rack accessories. So whether you're a traveller, cyclist, surfer or tradesperson - this roof rack system has you covered. Features: Removable Easy to install / remove Strong and built to last Suitable for heavy off-road use Compatible with a wide range of accessories Tested and approved to Australian Standard AS1235-2000",,
15,3pcs LM317 DC-DC Converter Buck Step Down Module Linear Regulator Adjustable Voltage Regulator Power Supply Board,"Feature: Output Current: 1.5A (minimum), 2.2A (typ) Input and output voltage difference (VI-VO): 40Vdc (max) Adjustable output voltage range: 1.2 ~ 37V Operating temperature: -55 to +150 Output Current: 1.5A Input voltage: 4.2 ~ 40 V Characteristics Frequency: 100 (MHz) Module size: 35.6 (mm) x16.8 (mm) Input: VIN positive input stage, GND negative input Output: VOUT output positive level, GND output negative Maximum output current: maximum output current = 3 / (Input voltage - output voltage) Applications: Mobile phone, MP3, MP4, PSP and much other charging equipment Package includes: 3 x Adjustable Linear Regulator",,
16,Baby Carrier Front Hold Baby Sitting on Lumbar Stool,Color classification: Sakura powder [pure cotton] breathable and comfortable mint blue [pure cotton] breathable and comfortable star blue [pure cotton] breathable and comfortable cherry powder [pure cotton] single stool mint blue [pure cotton] single stool star blue [pure Cotton] Single Stool Cherry Blossom Powder [Pure Cotton] Single Strap (without stool) Mint Blue[Pure Cotton] Single Strap (without stool) Star Blue [Pure Cotton] Single Strap (without stool) Wassil Blue[Polyester Cotton] Four Seasons Enjoy Light Peach Powder【Polyester Cotton】,,
17,Cargo Trouser Pants,"These Cargo Trouser Pants offer a practical and stylish solution for your everyday wardrobe. Featuring multiple pockets for convenient storage, these pants are perfect for busy days on the go. The durable and comfortable fabric ensures long-lasting wear, making these pants a reliable choice for any occasion. Upgrade your wardrobe with these versatile Cargo Trouser Pants.",,
18,Maternity Maxi Copper Tencel Panel Skirt,"Ladies maxi maternity copper tencel panel skirt with wide adjustable elastic waistband. ֲ Available in the following colors: Midnight Blue Black Composition: 100% Rayon Knit Washing Instructions: MACHINE WASH COLD, INSIDE OUT, NO CHLORINE BLEACH, HANG TO DRY",,
19,2018 Autumn Girl,,,
20,Mithai & More Thabdi Penda 250 gms And 500 gms,"A must try milk-based fudge, our succulent Thabdi Penda makes for a luxurious treat. Originating from Saurashtra, Gujarat, Thabdi Penda is an Indian sweet delight, prepared with Khoya, full cream milk and sugar. Pure ghee brings out the flavour of the sweet with perfection. The traditional sweet is popularly consumed during festivals and religious events. Available in 2 variants of 250 gm and 500 gm for you to choose from. Relish the delicious Thabdi Penda with your loved ones on significant celebrations including Birthdays and festivals such as Raksha Bandhan, Christmas, Diwali, Holi, New Year and Id. Shelf Life 25 Days Container Type Box Food Preference Vegetarian",,
21,Brizo Touch-Clean<sup>®</sup> Square Body Spray 84121-SL,"Brizo body sprays with Touch-Clean® Technology will surround you in water and engulf you in a fluid state. FEATURES 1/2"" rough-in Surface mount Body spray has 30˚ up and down spray adjustment Finished spray face",,
22,SÚPER FALLEROS (50),"Contingut: Caixa de 25 trons. Efecte: Tro 0,30 grams per peça. Nivell: 5/12 Categoria: F2 COMANDES I RECOLLIDES Segons la legislació vigent els productes pirotècnics de qualsevol categoria no es poden enviar a domicili, per la qual cosa la recollida s’haurà d’efectuar a la botiga. Només cal portar el resguard de compra i la comanda es pot recollir sense esperar.",,
23,C4M Pouch Enhancing Thong Pearl Extra Large,As the name implies the Cut4Men Enhanced Thong offers you unmatched comfort thanks to the ergonomically designed front pouch to enhance your manhood giving you a larger appearance to your masculinity. Natural push up and out effect 93% Polyester /7% Elastane Extremely sexy and flattering Soft seams for comfort Perfect balance of elasticity and support so everything stays in place,,
24,DCMASBC1N XR FlexVolt Brushcutter Attachment,"The DEWALT DCMASBC1N XR FlexVolt Brushcutter Attachment has a 20cm blade made of unique DEWALT Steel for fast effective cutting, with 4 tips for efficiency. Fitted with a guard that protects against flying debris. Part of the DCMAS57 XR FlexVolt Split Boom System; fits both DEWDAS5713X1 and DEWDCAS5713N.",,
25,"EDEL RECORDS RADIO STATION PRAVO, PATTY","EDEL RECORDS RADIO STATION PRAVO, PATTY Nome dell'articolo: stazione radio Tipologia di prodotto: ABIS_MUSIC Marca: EDEL RECORDS",,
26,Prince Lionheart My Twist'r Diaper System,"Prince Lionheart My Twist'r Diaper System Welcome to the new age of diaper disposal – the revolutionary and incredibly user-friendly My Twist’R® Diaper Pail. Developed with busy parents in mind, this product makes diapering easy and efficient without any tedious steps. Our Outsmarts Odors™ system traps odors, while our patented Drop. Step. Done® system seals shut waste without cutting or tying off anything! Say goodbye to smelly nurseries and spending time cleaning up pails – My Twist'R does it all so that you can focus on taking care of your baby. Plus, it’s stylish design fits right into any nursery so that you don't have to sacrifice beauty for utility. What’s more is that this wonderful product is strong enough to handle years of use, making sure that even after countless diaper changes, it still looks as good as new! Be prepared for your upcoming adventures in parenting - purchase the My Twist'R today! It’ll be the one thing out there that won’t add to your stress. Smart - Outsmar",,
27,のぼり旗 抽選場 W45×H180cm 金巾[1入],サイズ：W45×H180cm 素材：金巾 入数：1枚,,
28,"Alpha® T 20 Dog Collar, Dog Tracking Collar","TRACK YOUR PACK No matter what kind of dogs you run or how you hunt, Alpha® T 20 is the slim, rugged and universally sized collar designed to help you build a better dog — no matter the breed. Track your dog up to 14.5 kilometers when used with a compatible handheld (sold separately). Optimise your battery life with dynamic tracking. Collar is universally sized to fit large and small breeds. Easily change the user-replaceable flex band. Uses multicolour location beacon for low-light conditions. Get automatic software updates when charging and connected to your network with Wi-Fi® technology. WHAT YOU'LL LOVE TRACKING The top-mounted, high-sensitivity GPS and Galileo receiver keeps track of your dog’s location, and the Alpha® T 20 collar transmits that location via VHF up to 14.5 kilometers away with updates as frequent as every 2.5 seconds when used with a compatible handheld (sold separately). UNIVERSAL SIZING A rugged yet slim design is universally sized to fit large and small breeds",,
29,"BOLLARD IP66 MODIS OPTICS 1000MM LED 20W LED WARM-WHITE 3000K CASAMBI URBAN GREY | Urban grey, Transparent | Outdoor | AS15-18W9S3XBZ5",LedsC4 Modis Optics 1000mm AS15-18W9S3XBZ5V1 Bollard for outdoor use. Includes 2 cable outlets to facilitate chain mounting. The optical module can easily be rotated 360 º. Structure material: Aluminium. Structure finish: Urban grey. Diffuser material: Glass. Diffuser finish: Transparent. UV protection. Warranty: 5 Years. Product net weight (Kg): 0 Product width or diameter (mm): 140 Product height (mm): 1000 Product aperture (mm): 190 Class 1. IP: IP66. IK: IK10. LED. No. of lampholders or LEDs: 1. LED brand: SAMSUNG. Maximum power of light source: 18.3W. Colour temperature: 3000K. Colour rendering index: 92. MacAdam Steps: 3. Hours of life: 50.000h L80B20. UGR: 2.7. Photobiological risk: RG1. % de Flickering: +/- 5%. Real flux (lm): 1680. Real lm/W: 84. Voltage / frequency range: 220-240/50-60Hz. Voltage: 3. Equipment included: Yes. Total power: 20. Power factor: 0.95. Dimmable equipment included: CASAMBI.,,
30,Hand Forged Medieval Battle Axe,A battle axe is an axe specifically designed for combat. Knights often fought with battle axes when they were on foot. The battle axe struck with force could apply significant injury to a knight in armor. The weapon was primarily used as a cutting weapon and capable of cutting off the limbs of an enemy in one stroke. The handle is constructed of wood that has been stained. This one handed axe can be used for display or the finishing accessory to a period costume or re-enactment. Specifications: Overall Length: 16 Inches Blade Lengths: 6 Inches Handle Material: Wood,,
31,NGK 2016-09 Toyota Venza COP Pencil Type Ignition Coil,"NGK ignition coils are manufactured to meet or exceed OE standards for the highest durability and operational performance, so they can be installed with confidence. NGK and their family of automotive products have over 80 year's experience and are driven by extreme dedication to innovation, performance and quality. Developed and rigorously tested in our ISO 17025 accredited test lab under the most extreme conditions, NGK's coil designs will outperform all others - far beyond operational environments a vehicle would actually experience This Part Fits: Year Make Model Submodel 2007-2018 Lexus ES350 Base 2007-2015 Lexus RX350 Base 2013-2015 Lexus RX350 F Sport 2010-2015 Lexus RX450h Base 2016-2018 Lotus Evora 400 2010-2014 Lotus Evora Base 2013-2014 Lotus Evora S 2011-2012 Toyota Avalon Base 2005-2018 Toyota Avalon Limited 2005-2008,2016-2018 Toyota Avalon Touring 2005-2010 Toyota Avalon XL 2013-2018 Toyota Avalon XLE 2016-2018 Toyota Avalon XLE Plus 2013-2018 Toyota Avalon XLE Premium 20",,
32,"AE30M-Ft-01 Audio Signal Indicator, 90dB, 14V, IP34 MOFLASH Signalling","MOFLASH SIGNALLING - AE30M-FT-01 - Audio Signal Indicator, Industrial, Low Frequency, 90dB, 450Hz, 14VDC, 30mA, IP34, 35mm Ext. Depth Supply Voltage V AC: - Supply Voltage V DC: 14V Tones: Low Frequency Sound Level SPL: 90dB IP / NEMA Rating: IP34 Product Range: - Resonant Frequency: 450Hz Current Consumption: 30mA External Depth: 35mm Operating Temperature Min: -20°C Operating Temperature Max: 60°C SVHC: No SVHC (15-Jun-2015)",,
33,"Snap Hoop Monster 4""x4""","Snap Hoop Monster 4""x4"" Easy to use magnetic frame! Experience the effortless one step method to hoop and align fabrics. The secret of this magnetic hoop is in the patented design. It's perfect for Terry cloth Bulky fleece Quilt sandwiches Heavy fabrics Continuous embroidery Allover embroidery Easily make adjustments to hooped fabrics. The Snap Hoop Monster is easy to use and offers pain-free hooping with no hand strain! Stop hoop burn and master allover embroidery and multiple hoopings. With the Snap Hoop Monster you can stitch all the way to the edge of your fabric.",,
34,"Anrichte DKD Home Decor natürlich Weiß Mango-Holz (193 x 40,6 x 91,4 cm)","Wenn Sie Ihrem Zuhause einen Hauch von Originalität verleihen möchten, tun Sie dies mit Anrichte DKD Home Decor natürlich Weiß Mango-Holz (193 x 40,6 x 91,4 cm) . Farbe: Weiß natürlich Türen: 4 Regale: 2 Regale Material: Mango-Holz Design: Stern Mediterraner Maße ca.: 193 x 40,6 x 91,4 cm",,
35,Comunicador WIFI para Alerta Sismica,Marca: YONUSA SKU: YAS-WIFI Solución de YONUSA para tu hogar o negocio.,,
36,Software de Automatización Radio,"AVRA. Es un software de automatización de radio avanzado con capacidad de reproducción de video HD (720p) y software de mezcla de video de 6 canales con CG y generador de gráficos integrados para agregar el logotipo de la estación, rastreo de noticias, información meteorológica y leyendas personalizadas. AVRA incluye un codificador de video H.264 (720p) con salida RTMP para proveedores de servidores Flash / Wowzastreaming. AVRA es la evolución de la Radio. Al agregar las capacidades del servidor de video, aparece un nuevo mundo de oportunidades para los organismos de radiodifusión, el público y los clientes. AVRA está diseñado para funcionar con redes sociales como Skype, Youtube, Facebook y Twitter. Ideal para emisoras que buscan entrar en la nueva era de transmisiones de 'Radio Multimedia' (audio + video en línea). Incluye interfaz de selección de cámara automática Smart CAM. Conecte esta caja USB a las salidas GPO de su consola de audio y deje que el mezclador AVRA HDV cambie las cá",,
37,GT-Lite inkl. Vibrationsmotoren,"Eigenschaften: Originalgetreuer Rennsitz: Unser Premium-Schalensitz aus Fiberglas wurde exklusiv für GT-Rennen entwickelt und spiegelt das Erlebnis eines echten Rennwagens mit authentischer Polsterung für ein enges, realistisches Gefühl wider. Stabile Stützstruktur Unsere stabile Stützstruktur wurde entwickelt, um auch bei starken Bremsmanövern Sicherheit und Komfort bei langen Fahrten zu gewährleisten. M-DVF-Vibrationskompatibilität: Erleben Sie lebensechte Vibrationen mit einstellbaren Frequenzen (20-50 Hz) in sieben Intensitätsstufen. Die CONSPIT Link-Funktion ist ebenfalls verfügbar, genau wie bei unserem FPLITE-Modell. Anpassungsoptionen: Erweitern Sie Ihr Setup mit integrierten Monitorständern, Schalthebelhalterungen, Becherhaltern, Tastaturablagen und Maushaltern. Pro-Racing-Haltung: Unser Simulatorsitzrahmen der CONSPIT GT-Serie bietet umfangreiche Einstellmöglichkeiten für die perfekte Rennhaltung: Höhe und Winkel des Pedalsockels Winkel des Monitorständers Sitzposition (vorne",,
38,Hertz HRC BM2,Hertz HRC BM2 Bassfjernkontroll For å justere bassnivå. Passer til Hertz Marine Venezia -20 / +6dB justering for å tilpasse bass til personlig referanse VENEZIA V1 VENEZIA V1 24V VENEZIA V4 VENEZIA V5 VENEZIA V6 VENEZIA V6 24V VENEZIA V5C,,
39,"Dominant Rosin, Violin/Viola","Music strings of the highest quality this is both the incentive and obligation of Thomastik-Infeld. Based in the heart of Vienna, we have been developing and producing strings with the vastest range of tone colors since 1919, for bowed, plucked and world music instruments.",,
40,Bachmann Thomas & Friends 58744BE Gordon The Express Engine No 4 Steam Loco - OO Gauge,"DETAILS Gordon is a blue 4-6-2 ('Pacific' wheel arrangement) steam engine with the number 4 painted on his tender. Gordon first appeared in the 1st book in Reverend Wilbert Awdry's The Railway Series, entitled 'The Three Railway Engines,' in 1945 and two other books in the series are dedicated to him, No.8 'Gordon the Big Engine' and No.31 'Gordon the High Speed Engine.' He pulls the Express Coaches on the mainline. Other Locomotives , Coaches and Wagons are available to complete your Thomas The Tank Engine collection. FEATURES Moving eyes Realistic resemblance to the character in the series Compatible with OO/HO gauge track and model railways DCC ready 3+ compliant Suitable for young Thomas & Friends(TM) fans",,
41,Lovely Annie 1 Piece Women's Microfiber Hair Drying Towel/Cap/Hat Purple,"80% Women use electrical hair dryer after hair wash which causes damage to the fragile hair and as a result the hair become dried, broken and lose its natural luster after a while. This hair towl could dry your hair naturally and prevent damge to the health of your hair and make it look smooth and naturall! This microfiber hair drying towel can reduce the bacteria growth with the quick drying time and has a very soft touch on your hair! Funtions: Deep Cleaning Super Absorbent Gentle on Skin Microfiber Towel Pattern Multiple Colors Funtions: Size: 25 cm X 65 cm Weight Per Piece: 99.8 g Colors: Coral, Pink, Yellow and Purple",,
42,"New York Jets Tumbler 40oz Png, 40oz Tumler Png 87","40oz Tumbler Wrap template print sublimation PNG / instant download / high quality Commercial Use? You may sell creations you make with this file, so long as the end product is physical. You may not resell or give away this file in any way shape or form. I can always support you. Just write to me about any problems My files can also be used on printable vinyl, heat transfer paper, waterslides, you are only limited to your imagination! INSTANT DOWNLOAD -Contains the PNG files in High-resolution files. -This listing is for a digital download. No physical product will be shipped. Please contact me if you have any trouble with the files. I always want to ensure a happy customer. Happy crafting and thanks for visiting my shop.",,
43,"2PCS Retainer Case with Mirror and Adjustable Vent Holes, Cute Slim Aligner Case Compatible with Invisalign, Night Mouth Guard Case, With Retainer Remover Tool, Chew & Brush, White+White","Brand: Heigoeost Color: Round: White+White Features: PORTABLE RETAINER CASE WITH MAGNETIC CLOSE - These travel retainer cases are 3.15 in diameter × 1.1 in height, slim and lightweight. You can put these retainer holders in your purse, bag, lunch box and pocket. The magnetic closure keeps the case securely closed to ensure the safety of your aligner. ENOUGH INTERIOR SPACE - We went through a lot of research before designing these aligner cases to ensure they fit all aligner brands such as Invisalign. It can even accommodate retainer accessories such as an Invisalign remover tool, aligner chewies and Dental floss while storing your retainers. PREMIUM MATERIAL - These nightguard cases are made of food-grade ABS. Not only aligner, but you can also use these nightguard cases to store your wire retainer, partial denture, mouth guard, night guard and even your other small items. USER-FRIENDLY DESIGN - Built-in mirror helps you easily put on and take off the retainer and check if food is stuc",,
44,[Pre-order] YaHaHa with LED -ShenYin Studio,"Studio: ShenYin Studio Product Role: YaHaHa Size:23*18*18CM Price:129USD Deposit:69USD Release date:Q1 2025 Please check the policies on the page before the purchase Installment payments plan (Important） we will send invoice to your Paypal every 15th per month Deposit: 69USD(Paid now) Price: 129USD When product is ready for shipment, we will sand invoice to your Paypal to pay the shipping cost. First month: 60USD Estimated shipping cost（US,CA/AU, EU. UK）(Important) USA 40USD CA/AU 45USD EU USD UK 45USD If your region is not in the table, please message us for a shipping quote. The shipping cost will not exceed our maximum estimate, We will cover the excess parts. All of the delivery methods we utilize are based on standard delivery ( Air Freight less than 15days, Ocean Freight less than 20days.) If you require a FASTER method or CHEAPER method, please feel free to message us.",,
45,Coentros,Preço por meio quilo,,
46,Bodyworx T-Bar Trainer for Machines,"Key Features T-Bar trainer LBRT10 fits onto L314SR, L315SR, L415SR, L470HR, LU475PC & C516RS. Only applies to 2016 stock. Attaches to the main frame of all these products with two bolts. Internal double bearings for smooth rotation. Handle bar kits (LBRTKIT) available for olympic bars. Assembled Dimensions: 30cm (L) x 15cm (W) x 12cm (H).",,
